<?xml version="1.0" encoding="UTF-8"?>
<!DOCTYPE dataset SYSTEM "excilys-bank-dbunit.dtd">
<dataset>

	<USR ID="1000000000" FIRSTNAME="Stephane" LASTNAME="Landelle" LOGIN="slandelle" PASSWORD="password" EMAIL="slandelle@excilys.com" />
	<USR ID="1000000001" FIRSTNAME="Romain" LASTNAME="Sertelon" LOGIN="rsertelon" PASSWORD="password" EMAIL="rsertelon@excilys.com" />

	<USR_ROLE USR_ID="1000000000" ROLE_ID="ROLE_USER" />
	<USR_ROLE USR_ID="1000000000" ROLE_ID="ROLE_ADMIN" />
	<USR_ROLE USR_ID="1000000001" ROLE_ID="ROLE_USER" />

	<ACCOUNT ID="1000000000" NUMBER="0123456789AAXX" TYPE="PERSONNAL_CHECKING" BALANCE="50.00" BALANCE_DATE="2011-08-02 11:55:01" />
	<ACCOUNT ID="1000000001" NUMBER="0123456789AAYY" TYPE="JOINT_CHECKING" BALANCE="500.00" BALANCE_DATE="2011-08-02 11:55:01" />
	<ACCOUNT ID="1000000002" NUMBER="0123456789AAZZ" TYPE="PEL" BALANCE="1000.00" BALANCE_DATE="2011-08-02 11:55:01" />

	<USR_ACCOUNT USR_ID="1000000000" ACCOUNT_ID="1000000000" />
	<USR_ACCOUNT USR_ID="1000000000" ACCOUNT_ID="1000000001" />
	<USR_ACCOUNT USR_ID="1000000000" ACCOUNT_ID="1000000002" />

	<CARD ID="100000000000" NUMBER="XXXXX1" TYPE="CREDIT" ACCOUNT="1000000000" PENDING="-200" PENDING_DATE="2011-08-02 11:55:01" />
	<CARD ID="100000000001" NUMBER="XXXXX2" TYPE="DEBIT" ACCOUNT="1000000000" />
	<CARD ID="100000000002" NUMBER="XXXXX3" TYPE="DEBIT" ACCOUNT="1000000001" />

	<OPERATION ID="1000000000028" ACCOUNT="1000000000" STATUS="RESOLVED" TYPE="CARD" CARD="100000000000" AMOUNT="-100" NAME="cash -100" DATE="2011-07-01 11:55:01" />
	<OPERATION ID="1000000000029" ACCOUNT="1000000000" STATUS="PENDING" TYPE="CARD" CARD="100000000000" AMOUNT="-200" NAME="cash -200" DATE="2011-08-01 11:55:01" />

	<OPERATION ID="1000000000000" ACCOUNT="1000000000" STATUS="RESOLVED" TYPE="MISC" AMOUNT="100" NAME="cash +100" DATE="2011-07-28 11:55:01" />
	<OPERATION ID="1000000000001" ACCOUNT="1000000000" STATUS="RESOLVED" TYPE="MISC" AMOUNT="-200" NAME="cash -200" DATE="2011-07-27 11:55:01" />
	<OPERATION ID="1000000000002" ACCOUNT="1000000000" STATUS="RESOLVED" TYPE="MISC" AMOUNT="300" NAME="cash +300" DATE="2011-07-26 11:55:01" />
	<OPERATION ID="1000000000003" ACCOUNT="1000000000" STATUS="RESOLVED" TYPE="MISC" AMOUNT="100" NAME="cash +100" DATE="2011-07-25 11:55:01" />
	<OPERATION ID="1000000000004" ACCOUNT="1000000000" STATUS="RESOLVED" TYPE="MISC" AMOUNT="-200" NAME="cash -200" DATE="2011-07-24 11:55:01" />
	<OPERATION ID="1000000000005" ACCOUNT="1000000000" STATUS="RESOLVED" TYPE="MISC" AMOUNT="300" NAME="cash +300" DATE="2011-07-23 11:55:01" />
	<OPERATION ID="1000000000006" ACCOUNT="1000000000" STATUS="RESOLVED" TYPE="MISC" AMOUNT="100" NAME="cash +100" DATE="2011-07-22 11:55:01" />
	<OPERATION ID="1000000000007" ACCOUNT="1000000000" STATUS="RESOLVED" TYPE="MISC" AMOUNT="-200" NAME="cash -200" DATE="2011-07-21 11:55:01" />
	<OPERATION ID="1000000000008" ACCOUNT="1000000000" STATUS="RESOLVED" TYPE="MISC" AMOUNT="300" NAME="cash +300" DATE="2011-07-20 11:55:01" />
	<OPERATION ID="1000000000009" ACCOUNT="1000000000" STATUS="RESOLVED" TYPE="MISC" AMOUNT="100" NAME="cash +100" DATE="2011-07-19 11:55:01" />
	<OPERATION ID="1000000000010" ACCOUNT="1000000000" STATUS="RESOLVED" TYPE="MISC" AMOUNT="-200" NAME="cash -200" DATE="2011-07-18 11:55:01" />
	<OPERATION ID="1000000000011" ACCOUNT="1000000000" STATUS="RESOLVED" TYPE="MISC" AMOUNT="300" NAME="cash +300" DATE="2011-07-17 11:55:01" />
	<OPERATION ID="1000000000012" ACCOUNT="1000000000" STATUS="RESOLVED" TYPE="MISC" AMOUNT="100" NAME="cash +100" DATE="2011-07-16 11:55:01" />
	<OPERATION ID="1000000000013" ACCOUNT="1000000000" STATUS="RESOLVED" TYPE="MISC" AMOUNT="-200" NAME="cash -200" DATE="2011-07-15 11:55:01" />
	<OPERATION ID="1000000000014" ACCOUNT="1000000000" STATUS="RESOLVED" TYPE="MISC" AMOUNT="300" NAME="cash +300" DATE="2011-07-14 11:55:01" />
	<OPERATION ID="1000000000015" ACCOUNT="1000000000" STATUS="RESOLVED" TYPE="MISC" AMOUNT="100" NAME="cash +100" DATE="2011-07-13 11:55:01" />
	<OPERATION ID="1000000000016" ACCOUNT="1000000000" STATUS="RESOLVED" TYPE="MISC" AMOUNT="-200" NAME="cash -200" DATE="2011-07-12 11:55:01" />
	<OPERATION ID="1000000000017" ACCOUNT="1000000000" STATUS="RESOLVED" TYPE="MISC" AMOUNT="300" NAME="cash +300" DATE="2011-07-11 11:55:01" />
	<OPERATION ID="1000000000018" ACCOUNT="1000000000" STATUS="RESOLVED" TYPE="MISC" AMOUNT="100" NAME="cash +100" DATE="2011-07-10 11:55:01" />
	<OPERATION ID="1000000000019" ACCOUNT="1000000000" STATUS="RESOLVED" TYPE="MISC" AMOUNT="-200" NAME="cash -200" DATE="2011-07-09 11:55:01" />
	<OPERATION ID="1000000000020" ACCOUNT="1000000000" STATUS="RESOLVED" TYPE="MISC" AMOUNT="300" NAME="cash +300" DATE="2011-07-08 11:55:01" />
	<OPERATION ID="1000000000021" ACCOUNT="1000000000" STATUS="RESOLVED" TYPE="MISC" AMOUNT="100" NAME="cash +100" DATE="2011-07-07 11:55:01" />
	<OPERATION ID="1000000000022" ACCOUNT="1000000000" STATUS="RESOLVED" TYPE="MISC" AMOUNT="-200" NAME="cash -200" DATE="2011-07-06 11:55:01" />
	<OPERATION ID="1000000000023" ACCOUNT="1000000000" STATUS="RESOLVED" TYPE="MISC" AMOUNT="300" NAME="cash +300" DATE="2011-07-05 11:55:01" />
	<OPERATION ID="1000000000024" ACCOUNT="1000000000" STATUS="RESOLVED" TYPE="MISC" AMOUNT="100" NAME="cash +100" DATE="2011-07-04 11:55:01" />
	<OPERATION ID="1000000000025" ACCOUNT="1000000000" STATUS="RESOLVED" TYPE="MISC" AMOUNT="-200" NAME="cash -200" DATE="2011-07-03 11:55:01" />
	<OPERATION ID="1000000000026" ACCOUNT="1000000000" STATUS="RESOLVED" TYPE="MISC" AMOUNT="300" NAME="cash +300" DATE="2011-07-02 11:55:01" />
	<OPERATION ID="1000000000027" ACCOUNT="1000000000" STATUS="RESOLVED" TYPE="MISC" AMOUNT="100" NAME="cash +100" DATE="2011-07-01 11:55:01" />

	<OPERATION ID="100000000050" ACCOUNT="1000000000" STATUS="RESOLVED" TYPE="TRANSFER" AMOUNT="100" NAME="transfer +100" DATE="2011-07-01 11:55:01" />
	<OPERATION ID="100000000051" ACCOUNT="1000000000" STATUS="PENDING" TYPE="TRANSFER" AMOUNT="100" NAME="transfer +100" DATE="2011-07-01 11:56:01" />

	<OPERATION ID="100000000100" ACCOUNT="1000000001" STATUS="RESOLVED" TYPE="MISC" AMOUNT="400" NAME="cash +400" DATE="2011-07-25 11:55:01" />
	<OPERATION ID="100000000101" ACCOUNT="1000000001" STATUS="RESOLVED" TYPE="MISC" AMOUNT="500" NAME="cash +500" DATE="2011-07-24 11:55:01" />
	<OPERATION ID="100000000102" ACCOUNT="1000000001" STATUS="RESOLVED" TYPE="MISC" AMOUNT="-600" NAME="cash -600" DATE="2011-07-23 11:55:01" />
	<OPERATION ID="100000000103" ACCOUNT="1000000001" STATUS="RESOLVED" TYPE="MISC" AMOUNT="700" NAME="cash +700" DATE="2011-07-22 11:55:01" />

</dataset>